{
  "artifact_type": "state-snapshot",
  "snapshot_id": "C01-main-0",
  "character_id": "C01",
  "timeline_id": "main",
  "scene_context_id": "SC-0001",
  "story_order": 0,
  "story_time": "story:",
  "identity_contract_sha256": "0000000000000000000000000000000000000000000000000000000000000000",
  "era_contract_sha256": null,
  "form_contract_sha256": null,
  "appearance_variant_sha256": null,
  "applied_event_ids": [],
  "applied_process_milestones": [],
  "physical_state": {},
  "appearance_state": {},
  "wardrobe_state": {},
  "equipment_state": {},
  "inventory_state": {},
  "emotional_state": {},
  "performance_state": {},
  "knowledge_state": {},
  "social_role_state": {},
  "character_specific_state": {},
  "uncertainties": [],
  "state_snapshot_sha256": "0000000000000000000000000000000000000000000000000000000000000000",
  "species_profile_sha256": "0000000000000000000000000000000000000000000000000000000000000000",
  "individual_morphology_sha256": "0000000000000000000000000000000000000000000000000000000000000000"
}
